Id,Ref_agence,Title,Surface,Superficie Terrain,Type,Adresse,Pièces,Description,Prix,Bilan Energie,Emissions CO2,Equipements,main_img
5,IhDx70N8TTAIv7bT,Appartement neuf,85,,Appartement,33000 - BORDEAUX,4,"Vous souhaitez investir ou vous êtes à la recherche de votre résidence principale dans du neuf ?N'hésitez plus ! Venez découvrir ce nouveau programme idéalement situé, à deux pas du centre ville et des transports en communs. Nous vous proposons des appartements du 2 au 5 pièces à partir de 266 000 euros Eligible loi PINEL Livraison à partir du 4ème trimestre 2023 395000 euros Honoraires à la charge du vendeur.","€395,000.00",221,76,"Parking,Terrasse / Balcon,Climatisation",Apartment_Elizabetes_22_Unique_Appartment_Riga_Latvia_-_Booking.com (https://dl.airtable.com/.attachments/d4a27d4213c40baed152e6a302da3c49/3a109bcf/Apartment_Elizabetes_22_Unique_Appartment_Riga_Latvia_-_Booking.com)
6,rdlVFmA1YtSBYcXN,Appartement centre ville,40,,Appartement,33000 - BORDEAUX,4,"BORDEAUX - HYPER CENTRE Au pied de la place Camille Jullian, agréable appartement de type 2 pièces composé d'une entrée, séjour avec cuisine ouverte, chambre et salle de bain. Parties communes et immeuble en parfait état. Copropriété de 3 lots Charges annuelles : 0 euros. 285000 euros Honoraires à la charge du vendeur.","€285,000.00",127,13,"Cuisine équipée,Parking,Terrasse / Balcon",Tuzlaks_appartment_Entire_apartment_(Sarajevo)_-_Deals_Photos_... (https://dl.airtable.com/.attachments/2d88a269edfeaba0b2c47623a4dc7000/8823a570/Tuzlaks_appartment_Entire_apartment_Sarajevo_-_Deals_Photos_...)
7,y2ocxHGMT8W1y5wX,Maison 4p,90,356,Maison,33810 - AMBES,4,"Proche de la place Nansouty En seconde ligne, nous vous proposons une maison lumineuse de quatre pièces avec une jolie terrasse de 40 m2. Dans une petite copropriété, cette maison est composée de deux niveaux, au rez-de-chaussée un grand séjour donnant sur la terrasse, une cuisine entièrement équipée, une suite parentale avec salle d'eau, WC. Au premier étage, un palier desservant deux chambres, une salle d'eau avec WC et une buanderie. Climatisation, rangements, panneaux solaires? Parking privatif Proximité des transports et de toutes commodités. Copropriété de 20 lots Charges annuelles : 530 euros. 480000 euros Honoraires à la charge du vendeur.","€480,000.00",135,35,"Cuisine équipée,Cheminée,Terrasse / Balcon",Unique_Hotel_in_San_Rafael__Maison_Couturier_San_Rafael_a_... (https://dl.airtable.com/.attachments/1c820fc050ce8a41e14c39bca7d528ab/52d8dd21/Unique_Hotel_in_San_Rafael__Maison_Couturier_San_Rafael_a_...)
8,xT5bvhMWyT0mtAFb,Maison 6 pièces,156,780,Maison,33230 - COUTRAS,6,"Venez découvrir cette superbe maison contemporaine idéalement située, au calme et à quelques minutes à pied du centre-ville. Vous pourrez profiter immédiatement de cette maison de plain-pied où aucun travaux ne sont à prévoir : 4 chambres avec placards, un bureau, une cuisine neuve ouverte sur la vaste pièce de vie, une grande véranda et sa cuisine d'été, le tout sur un terrain entièrement clôturé sans vis-à-vis ! Bien conçue et très bien entretenue, cette maison n'attend plus que ses futurs propriétaires!","€256,000.00",176,96,"Terrasse / Balcon,Cheminée,Garage",Maison (https://dl.airtable.com/.attachments/53cf5aadba961d2d302496f02737ed14/9ec695bd/Maison)
9,zgivCnw9DeclF4eQ,Maison 4 chambres,141,650,Maison,33810 - AMBES,5,"Située en plein centre de la commune d'Ambès (C.U.B.), à 20 mn du pont Chaban Delmas, venez découvrir, cette contemporaine spacieuse et lumineuse, aux matériaux de qualités, comprenant, entrée, une pièce à vire d'environ 45 m², cuisine équipée semi-ouverte, 4 chambres, cellier et salle de bains avec douche à l'talienne, terrasse carrelée et pergola, sur un terrain clos et piscinable d'environ 800 m². Cette maison est équipée de panneaux photovoltaïques avec très bon rapport à l'année, ce qui permet de couvrir l'ensemble des charges annuelles. Coup de coeur assuré !","€320,900.00",202,16,"Terrasse / Balcon,Garage,Cuisine équipée,Séjour de plus de 30 mètres²",Maison (https://dl.airtable.com/.attachments/ae8203867fb0c50b087995f7f64d76a1/ede9465c/Maison)
10,oOTbW9FfE1C4733n,Terrain à Andernos,0,385,Terrain,33510 - ANDERNOS LES BAINS,0,"Superbe terrain à bâtir de 385 m² environ avec une emprise au sol de 30%, en première ligne, clôturé sur trois côtés et avec portail motorisé. Situé à 600 mètres de la plage, ce terrain n'attend plus que votre résidence principale ou secondaire ! ","€290,000.00",,,,How_to_Make_Beautiful_Terrain_in_Unity_2020__Beginner_Tutorial_... (https://dl.airtable.com/.attachments/40d8fb659987a1237a27eea1674da8e8/4b95e487/How_to_Make_Beautiful_Terrain_in_Unity_2020__Beginner_Tutorial_...)
11,kl4csf7rMB9AmiUB,Terrain de 800m²,0,800,Terrain,33000 - BORDEAUX,0,"Terrain viabilisé de 800 m², au coeur de Bordeaux, proche centre-ville.","€450,000.00",,,,Ground_pearls_in_turf_-_GCMOnline.com (https://dl.airtable.com/.attachments/e1d5d26217f8d8249638183b14f0aa91/d0ec6fd3/Ground_pearls_in_turf_-_GCMOnline.com)